{
  "contractVersion": "automation-metric-web-snapshot-v1",
  "captureId": "cap-synthetic-001",
  "specDigest": "cccccccccccccccccccccccccccccccccccccccccccccccccccccccccccccccc",
  "capturedAt": "2026-09-21T03:15:00Z",
  "scope": {
    "keywords": [
      "bình giữ nhiệt",
      "Bình nước"
    ],
    "platforms": [
      "shopee",
      "tiktok"
    ],
    "period": {
      "startDate": "2025-09-15",
      "endDate": "2026-09-20"
    },
    "category": "Nhà cửa & Đời sống",
    "ticks": [
      "Chỉ sản phẩm có lượt bán"
    ],
    "advancedFilters": [
      {
        "label": "Giá",
        "displayed": "50.000 - 500.000"
      }
    ],
    "exclusions": [
      "nắp thay thế"
    ]
  },
  "groups": {
    "W2_kpi": {
      "revenue": {
        "current": {
          "label": "Doanh số",
          "displayed": "12,3 tỷ",
          "value": 12312345678,
          "unit": "VND",
          "precision": "exact",
          "platform": "all",
          "period": {
            "startDate": "2025-09-15",
            "endDate": "2026-09-20"
          },
          "sourcePointer": "overview.revenue.value"
        },
        "changePct": {
          "label": "Doanh số - % so với kỳ liền kề",
          "displayed": "18,4%",
          "value": 18.4,
          "unit": "PERCENT",
          "precision": "exact",
          "platform": "all",
          "period": {
            "startDate": "2025-09-15",
            "endDate": "2026-09-20"
          },
          "sourcePointer": "overview.revenue.change"
        }
      },
      "units": {
        "current": {
          "label": "Lượt bán",
          "displayed": "1.234.567",
          "value": 1234567,
          "unit": "COUNT",
          "precision": "exact",
          "platform": "all",
          "period": {
            "startDate": "2025-09-15",
            "endDate": "2026-09-20"
          },
          "sourcePointer": "overview.units.value"
        },
        "changePct": {
          "label": "Lượt bán - % so với kỳ liền kề",
          "displayed": "-5,2%",
          "value": -5.2,
          "unit": "PERCENT",
          "precision": "exact",
          "platform": "all",
          "period": {
            "startDate": "2025-09-15",
            "endDate": "2026-09-20"
          },
          "sourcePointer": "overview.units.change"
        }
      },
      "soldListings": {
        "current": {
          "label": "Sản phẩm có lượt bán",
          "displayed": "850 nghìn",
          "value": 850210,
          "unit": "COUNT",
          "precision": "exact",
          "platform": "all",
          "period": {
            "startDate": "2025-09-15",
            "endDate": "2026-09-20"
          },
          "sourcePointer": "overview.soldListings.value"
        },
        "changePct": {
          "label": "Sản phẩm có lượt bán - % so với kỳ liền kề",
          "displayed": "3,1%",
          "value": 3.1,
          "unit": "PERCENT",
          "precision": "exact",
          "platform": "all",
          "period": {
            "startDate": "2025-09-15",
            "endDate": "2026-09-20"
          },
          "sourcePointer": "overview.soldListings.change"
        }
      },
      "shops": {
        "current": {
          "label": "Gian hàng có lượt bán",
          "displayed": "4.512",
          "value": 4512,
          "unit": "COUNT",
          "precision": "exact",
          "platform": "all",
          "period": {
            "startDate": "2025-09-15",
            "endDate": "2026-09-20"
          },
          "sourcePointer": "overview.shops.value"
        },
        "changePct": {
          "label": "Gian hàng có lượt bán - % so với kỳ liền kề",
          "displayed": "-",
          "value": null,
          "unit": "PERCENT",
          "precision": "display_rounded",
          "platform": "all",
          "period": {
            "startDate": "2025-09-15",
            "endDate": "2026-09-20"
          },
          "sourcePointer": "overview.shops.change"
        }
      }
    },
    "W3_platformSplit": [
      {
        "platform": "shopee",
        "revenue": {
          "label": "Doanh số",
          "displayed": "8 tỷ",
          "value": 8012345678,
          "unit": "VND",
          "precision": "exact",
          "platform": "shopee",
          "period": {
            "startDate": "2025-09-15",
            "endDate": "2026-09-20"
          },
          "sourcePointer": "platform.shopee.revenue"
        },
        "share": {
          "label": "Tỷ trọng",
          "displayed": "65,1%",
          "value": 65.08,
          "unit": "PERCENT",
          "precision": "exact",
          "platform": "shopee",
          "period": {
            "startDate": "2025-09-15",
            "endDate": "2026-09-20"
          },
          "sourcePointer": "platform.shopee.share"
        }
      },
      {
        "platform": "tiktok",
        "revenue": {
          "label": "Doanh số",
          "displayed": "4,3 tỷ",
          "value": 4300000000,
          "unit": "VND",
          "precision": "exact",
          "platform": "tiktok",
          "period": {
            "startDate": "2025-09-15",
            "endDate": "2026-09-20"
          },
          "sourcePointer": "platform.tiktok.revenue"
        },
        "share": {
          "label": "Tỷ trọng",
          "displayed": "34,9%",
          "value": 34.92,
          "unit": "PERCENT",
          "precision": "exact",
          "platform": "tiktok",
          "period": {
            "startDate": "2025-09-15",
            "endDate": "2026-09-20"
          },
          "sourcePointer": "platform.tiktok.share"
        }
      }
    ],
    "W4_monthly": [
      {
        "platform": "shopee",
        "month": "2025-09",
        "revenue": {
          "label": "Doanh số",
          "displayed": "512,3 triệu",
          "value": 512345000,
          "unit": "VND",
          "precision": "exact",
          "platform": "shopee",
          "period": {
            "startDate": "2025-09-15",
            "endDate": "2025-09-30"
          },
          "sourcePointer": "chart.growth.shopee[0].revenue"
        },
        "units": {
          "label": "Lượt bán",
          "displayed": "4.100",
          "value": 4100,
          "unit": "COUNT",
          "precision": "exact",
          "platform": "shopee",
          "period": {
            "startDate": "2025-09-15",
            "endDate": "2025-09-30"
          },
          "sourcePointer": "chart.growth.shopee[0].units"
        }
      },
      {
        "platform": "tiktok",
        "month": "2025-09",
        "revenue": {
          "label": "Doanh số",
          "displayed": "287,7 triệu",
          "value": 287654000,
          "unit": "VND",
          "precision": "exact",
          "platform": "tiktok",
          "period": {
            "startDate": "2025-09-15",
            "endDate": "2025-09-30"
          },
          "sourcePointer": "chart.growth.tiktok[0].revenue"
        },
        "units": null
      },
      {
        "platform": "shopee",
        "month": "2025-10",
        "revenue": {
          "label": "Doanh số",
          "displayed": "533,3 triệu",
          "value": 533345000,
          "unit": "VND",
          "precision": "exact",
          "platform": "shopee",
          "period": {
            "startDate": "2025-10-01",
            "endDate": "2025-10-31"
          },
          "sourcePointer": "chart.growth.shopee[1].revenue"
        },
        "units": {
          "label": "Lượt bán",
          "displayed": "4.137",
          "value": 4137,
          "unit": "COUNT",
          "precision": "exact",
          "platform": "shopee",
          "period": {
            "startDate": "2025-10-01",
            "endDate": "2025-10-31"
          },
          "sourcePointer": "chart.growth.shopee[1].units"
        }
      },
      {
        "platform": "tiktok",
        "month": "2025-10",
        "revenue": {
          "label": "Doanh số",
          "displayed": "300,7 triệu",
          "value": 300654000,
          "unit": "VND",
          "precision": "exact",
          "platform": "tiktok",
          "period": {
            "startDate": "2025-10-01",
            "endDate": "2025-10-31"
          },
          "sourcePointer": "chart.growth.tiktok[1].revenue"
        },
        "units": null
      },
      {
        "platform": "shopee",
        "month": "2025-11",
        "revenue": {
          "label": "Doanh số",
          "displayed": "554,3 triệu",
          "value": 554345000,
          "unit": "VND",
          "precision": "exact",
          "platform": "shopee",
          "period": {
            "startDate": "2025-11-01",
            "endDate": "2025-11-30"
          },
          "sourcePointer": "chart.growth.shopee[2].revenue"
        },
        "units": {
          "label": "Lượt bán",
          "displayed": "4.174",
          "value": 4174,
          "unit": "COUNT",
          "precision": "exact",
          "platform": "shopee",
          "period": {
            "startDate": "2025-11-01",
            "endDate": "2025-11-30"
          },
          "sourcePointer": "chart.growth.shopee[2].units"
        }
      },
      {
        "platform": "tiktok",
        "month": "2025-11",
        "revenue": {
          "label": "Doanh số",
          "displayed": "313,7 triệu",
          "value": 313654000,
          "unit": "VND",
          "precision": "exact",
          "platform": "tiktok",
          "period": {
            "startDate": "2025-11-01",
            "endDate": "2025-11-30"
          },
          "sourcePointer": "chart.growth.tiktok[2].revenue"
        },
        "units": null
      },
      {
        "platform": "shopee",
        "month": "2025-12",
        "revenue": {
          "label": "Doanh số",
          "displayed": "575,3 triệu",
          "value": 575345000,
          "unit": "VND",
          "precision": "exact",
          "platform": "shopee",
          "period": {
            "startDate": "2025-12-01",
            "endDate": "2025-12-31"